<?xml version="1.0" encoding="UTF-8"?>

<!DOCTYPE sun-web-app PUBLIC '-//Sun Microsystems, Inc.//DTD Sun ONE Application Server 8.0 Servlet 2.4//EN' 'http://www.sun.com/software/sunone/appserver/dtds/sun-web-app_2_4-0.dtd'>

<sun-web-app>
  <session-config>
    <session-manager/>
  </session-config>
  <resource-ref>
    <res-ref-name>jms/MyQueueConnectionFactory</res-ref-name>
    <jndi-name>jms/jms_msgdest_jmsweb_QCF</jndi-name>
  </resource-ref>
  <message-destination>
    <message-destination-name>WebQueue</message-destination-name>
    <jndi-name>jms/jms_msgdest_jmsweb_ServletQueue</jndi-name>
  </message-destination>
  <jsp-config/>
</sun-web-app>

